{
  "dcp_version": "2.0",
  "obligation_id": "obligation:data-retention-2026-005",
  "session_nonce": "a1b2c3d4e5f6a1b2c3d4e5f6a1b2c3d4e5f6a1b2c3d4e5f6a1b2c3d4e5f6a1b2",
  "agent_id": "agent:research-bot-v2-001",
  "human_id": "human:alice-abc-123",
  "obligation_type": "data_retention_compliance",
  "compliance_status": "compliant",
  "evidence_hashes": [
    "1122334455667788990011223344556677889900112233445566778899001122",
    "aabbccddeeff00112233445566778899aabbccddeeff00112233445566778899"
  ],
  "timestamp": "2026-03-01T08:30:00Z",
  "composite_sig": {
    "classical": { "alg": "ed25519", "kid": "a1b2c3d4e5f6a1b2c3d4e5f6a1b2c3d4", "sig_b64": "dGVzdHNpZzEyMzQ1Njc4OTAxMjM0NTY=" },
    "pq": { "alg": "ml-dsa-65", "kid": "d4e5f6a1b2c3d4e5f6a1b2c3d4e5f6a1", "sig_b64": "dGVzdHBxc2lnMTIzNDU2Nzg5MDEyMzQ1Ng==" },
    "binding": "pq_over_classical"
  }
}
